{
  "$schema": "https://json-schema.org/draft/2020-12/schema",
  "$id": "https://pseudoai.news/schema/news.schema.json",
  "title": "PseudoAI News Feed",
  "description": "Schema for curated news items used in the PseudoAI Sales website.",
  "type": "array",
  "minItems": 1,
  "items": {
    "type": "object",
    "additionalProperties": false,
    "required": [
      "slug",
      "title",
      "publishedAt",
      "source",
      "language",
      "originalUrl",
      "quote",
      "summary",
      "relevanceBullets"
    ],
    "properties": {
      "slug": {
        "type": "string",
        "pattern": "^[a-z0-9-]+$",
        "description": "URL-safe unique identifier in kebab-case."
      },
      "title": {
        "type": "string",
        "minLength": 10,
        "description": "Full article title."
      },
      "publishedAt": {
        "type": "string",
        "format": "date",
        "description": "Publication date in ISO format (YYYY-MM-DD)."
      },
      "source": {
        "type": "string",
        "minLength": 2,
        "description": "Name of the publication."
      },
      "language": {
        "type": "string",
        "enum": ["nl", "en"],
        "description": "Language of the original article. Only Dutch (nl) or English (en) allowed."
      },
      "originalUrl": {
        "type": "string",
        "format": "uri",
        "description": "Canonical URL of the original article."
      },
      "quote": {
        "type": "string",
        "maxLength": 200,
        "description": "Short quote or excerpt (max 200 characters)."
      },
      "summary": {
        "type": "string",
        "minLength": 50,
        "description": "2–4 sentence neutral summary written in own words."
      },
      "relevanceBullets": {
        "type": "array",
        "minItems": 2,
        "maxItems": 2,
        "items": {
          "type": "string",
          "minLength": 20
        },
        "description": "Exactly two bullets explaining why this article is relevant for pseudoAI."
      },
      "tags": {
        "type": "array",
        "uniqueItems": true,
        "items": {
          "type": "string",
          "enum": [
            "shadow-ai",
            "governance",
            "security",
            "privacy",
            "compliance",
            "data-leakage",
            "data-protection",
            "byoai",
            "attack-surface",
            "shadow-it"
          ]
        },
        "description": "Optional taxonomy tags."
      },
      "lastCheckedAt": {
        "type": "string",
        "format": "date-time",
        "description": "ISO 8601 timestamp of the last URL validation check."
      },
      "httpStatus": {
        "type": ["integer", "null"],
        "description": "HTTP status code returned during the last validation check."
      },
      "finalUrl": {
        "type": "string",
        "format": "uri",
        "description": "Final URL after following all redirects."
      },
      "isReachable": {
        "type": "boolean",
        "description": "Whether the URL was reachable (HTTP 2xx) during the last check."
      },
      "paywallSuspected": {
        "type": "boolean",
        "description": "Whether a paywall was detected heuristically during the last check."
      },
      "loginRequiredSuspected": {
        "type": "boolean",
        "description": "Whether a login requirement was detected during the last check."
      },
      "validationStatus": {
        "type": "string",
        "enum": ["ok", "warning", "invalid"],
        "description": "Overall validation outcome: ok, warning (paywall/redirect), or invalid (unreachable)."
      },
      "validationNotes": {
        "type": "string",
        "description": "Human-readable notes from the last validation run."
      }
    }
  }
}
