[
  {
    "slug": "cisco-ai-security-paradox-shadow-ai-blind-spot",
    "title": "The AI Security Paradox – How Shadow AI Became the Enterprise’s Biggest Blind Spot",
    "publishedAt": "2026-10-14",
    "source": "Cisco Blogs",
    "language": "en",
    "originalUrl": "https://blogs.cisco.com/ai/the-ai-security-paradox-how-shadow-ai-became-the-enterprises-biggest-blind-spot",
    "quote": "Data protection also has to move closer to the AI interaction itself.",
    "summary": "Cisco beschrijft hoe medewerkers generatieve AI gebruiken buiten het zicht van securityteams. Het artikel verwijst naar onderzoek waaruit blijkt dat 47% van de GenAI-gebruikers persoonlijke AI-applicaties gebruikt en organisaties gemiddeld 223 AI-gerelateerde overtredingen van databeleid per maand registreren. Cisco pleit voor zichtbaarheid en beheersing van gegevensstromen op browser-, API-, endpoint- en applicatieniveau, zonder productief AI-gebruik onnodig te blokkeren.",
    "relevanceBullets": [
      "Concrete onderzoeksresultaten maken duidelijk hoe vaak gevoelige bedrijfsinformatie buiten gecontroleerde AI-kanalen terecht kan komen.",
      "Cisco bepleit gegevensbescherming dicht op de AI-interactie: een directe aanleiding om informatie vóór verzending te beoordelen en te minimaliseren."
    ],
    "tags": [
      "shadow-ai",
      "data-leakage",
      "security",
      "governance"
    ]
  },
  {
    "slug": "csa-dlp-ai-era-data-loss-after-the-fact-2026",
    "title": "New Cloud Security Alliance Survey Finds Data Loss Prevention (DLP) Often Detects Data Loss Only After It Happens",
    "publishedAt": "2026-10-13",
    "source": "Cloud Security Alliance",
    "language": "en",
    "originalUrl": "https://cloudsecurityalliance.org/press-releases/2026/10/13/new-cloud-security-alliance-survey-finds-data-loss-prevention-dlp-often-detects-data-loss-only-after-it-happens",
    "quote": "only 16% said DLP blocked their most significant incident before data left the organization.",
    "summary": "De Cloud Security Alliance publiceert een onderzoek onder 433 IT- en securityprofessionals naar de effectiviteit van Data Loss Prevention in het AI-tijdperk. Van de respondenten meldde 73% minstens één bevestigd incident met gegevensverlies in de voorgaande 24 maanden. Slechts 16% zei dat DLP het ernstigste incident voorkwam voordat gegevens de organisatie verlieten; 29% kan routinematig rapporteren welke gevoelige gegevens naar generatieve AI gaan. Het onderzoek is uitgevoerd met en gefinancierd door DLP-leverancier Jazz.",
    "relevanceBullets": [
      "De gemeten beperkingen in DLP-zichtbaarheid en preventie tonen waarom controle op gevoelige gegevens richting generatieve AI cruciaal is.",
      "Dataminimalisatie vóór AI kan bestaande DLP-maatregelen aanvullen door de hoeveelheid gevoelige informatie die überhaupt wordt verzonden te verkleinen."
    ],
    "tags": [
      "data-leakage",
      "security",
      "governance",
      "privacy"
    ]
  },
  {
    "slug": "healthcare-unauthorized-ai-agents-patient-data",
    "title": "Health care's emerging risk: unauthorized AI agents",
    "publishedAt": "2026-10-05",
    "source": "Axios",
    "language": "en",
    "originalUrl": "https://www.axios.com/2026/10/05/ai-agents-hospital-risks",
    "quote": "health care organizations need to know what they can access, what they're allowed to do",
    "summary": "Axios beschrijft de toenemende inzet van AI-agenten binnen zorgorganisaties en de bijbehorende risico's voor patiëntgegevens. Volgens onderzoek onder 250 functionarissen op het gebied van zorgbeveiliging en AI-strategie geeft 72% aan dat AI-tools of agenten zonder formele IT-goedkeuring worden ingezet. AI-agenten krijgen mogelijk toegang tot patiëntdossiers, financiële systemen en communicatieplatforms. Beveiligingsexperts benadrukken daarom het belang van beperkte toegangsrechten, duidelijke bevoegdheden en toezicht op gegevensverwerking.",
    "relevanceBullets": [
      "Laat zien waarom AI-agenten uitsluitend toegang moeten krijgen tot persoonsgegevens die noodzakelijk zijn voor hun specifieke werkzaamheden.",
      "Onderstreept dat controle op de gegevens die AI kan benaderen essentieel is om onnodige verwerking van patiëntinformatie te voorkomen."
    ],
    "tags": [
      "shadow-ai",
      "privacy",
      "governance",
      "data-leakage"
    ]
  },
  {
    "slug": "computable-werknemers-prive-ai-werk-2026",
    "title": "Helft werknemers gebruikt privé-ai voor werk",
    "publishedAt": "2026-10-02",
    "source": "Computable",
    "language": "nl",
    "originalUrl": "https://www.computable.nl/2026/10/02/helft-werknemers-gebruikt-prive-ai-voor-werk/",
    "quote": "Werknemers zijn terughoudender met het delen van persoonlijke informatie dan met informatie uit hun werkomgeving.",
    "summary": "Computable bericht over het Cybersecurity gedragsonderzoek Alert Online 2026. Daaruit blijkt dat 49% van de werknemers privé-AI-accounts of apps voor werk gebruikt en 35% AI inzet zonder toestemming of medeweten van de organisatie. Slechts 39% weet welke AI-tools binnen de organisatie zijn toegestaan. Het onderzoek signaleert bovendien dat werknemers terughoudender zijn met privégegevens dan met informatie uit hun werkomgeving.",
    "relevanceBullets": [
      "Het Nederlandse onderzoek laat zien dat werkinformatie via privé-AI-accounts buiten het formele toezicht van organisaties kan worden verwerkt.",
      "Ondersteunt de noodzaak om medewerkers automatisch te helpen gevoelige informatie te herkennen en te beperken voordat zij AI gebruiken."
    ],
    "tags": [
      "shadow-ai",
      "privacy",
      "governance"
    ]
  },
  {
    "slug": "privacy-filter-enterprise-generative-ai",
    "title": "Privacy Filter: A critical control for enterprise Generative AI",
    "publishedAt": "2026-09-29",
    "source": "Express Computer",
    "language": "en",
    "originalUrl": "https://www.expresscomputer.in/guest-blogs/privacy-filter-a-critical-control-for-enterprise-generative-ai/139316/",
    "quote": "Actions including redaction, masking, and tokenization can then be applied before information leaves the organisation.",
    "summary": "Express Computer publiceert een analyse van Gartner-analist Stefan Dumitrescu over het beschermen van gevoelige informatie bij generatieve AI. Hij adviseert organisaties een modelonafhankelijk privacyfilter in het gegevenspad te plaatsen dat persoonsgegevens, credentials, bedrijfsgeheimen en andere vertrouwelijke informatie detecteert en vóór verzending kan redacteren, maskeren of tokeniseren. Daarmee blijven privacyregels onder controle van de organisatie, onafhankelijk van de gebruikte AI-provider.",
    "relevanceBullets": [
      "Beschrijft vrijwel exact de PseudoAI-benadering: gevoelige gegevens detecteren en redacteren, maskeren of tokeniseren voordat zij naar een AI-model gaan.",
      "Onderbouwt dat organisaties niet uitsluitend op privacymaatregelen van AI-providers moeten vertrouwen, maar zelf een controlelaag vóór AI nodig hebben."
    ],
    "tags": [
      "privacy",
      "data-leakage",
      "governance",
      "compliance"
    ]
  },
  {
    "slug": "ncsc-hidden-risks-shadow-ai",
    "title": "The hidden risks of shadow AI",
    "publishedAt": "2026-09-07",
    "source": "National Cyber Security Centre",
    "language": "en",
    "originalUrl": "https://www.ncsc.gov.uk/blogs/the-hidden-risks-of-shadow-ai",
    "quote": "Employees who transfer sensitive or proprietary information to consumer AI services will likely reduce the organisation's visibility and control over that information.",
    "summary": "Het Britse National Cyber Security Centre waarschuwt organisaties voor het gebruik van niet-goedgekeurde AI-tools door medewerkers. Wanneer medewerkers gevoelige bedrijfs- of klantinformatie naar consumenten-AI sturen, kan die informatie buiten bestaande beveiligings- en governance-afspraken worden opgeslagen, bewaard of gebruikt. De NCSC adviseert organisaties veilige, goedgekeurde alternatieven te bieden en bewustzijn te creëren over welke gegevens met AI worden gedeeld.",
    "relevanceBullets": [
      "Laat concreet zien dat gevoelige bedrijfs- en klantinformatie via medewerkers buiten de gecontroleerde organisatieomgeving bij AI-diensten kan belanden.",
      "Ondersteunt de noodzaak om vóór AI-gebruik te bepalen welke informatie daadwerkelijk mag worden gedeeld en welke gegevens moeten worden afgeschermd."
    ],
    "tags": [
      "shadow-ai",
      "privacy",
      "data-leakage",
      "governance"
    ]
  },
  {
    "slug": "thomson-reuters-shadow-ai-sensitive-information",
    "title": "Corporate Inaction on AI Casts a Long Shadow",
    "publishedAt": "2026-09-03",
    "source": "Thomson Reuters Institute",
    "language": "en",
    "originalUrl": "https://www.thomsonreuters.com/en-us/posts/innovation/corporate-inaction-on-ai-casts-a-long-shadow/",
    "quote": "proprietary or sensitive information that should not be shared on external servers",
    "summary": "Thomson Reuters Institute beschrijft hoe shadow AI ontstaat wanneer organisaties achterblijven met formele AI-adoptie. Volgens het Future of Professionals Report 2026 gebruikt 36% van professionals in corporate tax, legal en compliance AI-tools die hun organisatie niet heeft goedgekeurd. Het artikel koppelt dit rechtstreeks aan information leakage, compliance-risico's en het verwerken van bedrijfseigen of gevoelige informatie via externe AI-diensten.",
    "relevanceBullets": [
      "Juist juridische, fiscale en compliancefuncties gebruiken ongeautoriseerde AI, terwijl zij veel vertrouwelijke en gereguleerde informatie verwerken.",
      "Het artikel benoemt expliciet dat bedrijfseigen en gevoelige informatie niet ongecontroleerd op externe AI-servers thuishoort."
    ],
    "tags": [
      "shadow-ai",
      "data-leakage",
      "governance",
      "compliance"
    ]
  },
  {
    "slug": "techradar-shadow-ai-eu-ai-act-data-control",